{
  "featured_paper": null,
  "month": "2024-02",
  "sections": [
    {
      "paper_ids": [
        "2403.03222",
        "2402.17772",
        "2402.17433"
      ],
      "title": "new_model"
    }
  ],
  "stats": {
    "accepted": 2,
    "candidates": 7,
    "summarized": 3
  },
  "top_picks": [
    "2402.17433",
    "2403.03222",
    "2402.17772"
  ]
}
