{
  "featured_paper": null,
  "month": "2026-07",
  "sections": [
    {
      "paper_ids": [
        "2607.24834",
        "2607.24519",
        "2607.27268"
      ],
      "title": "benchmark"
    },
    {
      "paper_ids": [
        "2607.03094",
        "2607.03925",
        "2607.22397"
      ],
      "title": "method"
    },
    {
      "paper_ids": [
        "2607.07720",
        "2607.06629",
        "2607.09543",
        "2607.11578",
        "2607.21384",
        "2607.21402",
        "2607.23554",
        "2607.27308",
        "2607.27913"
      ],
      "title": "new_model"
    }
  ],
  "stats": {
    "accepted": 15,
    "candidates": 33,
    "summarized": 15
  },
  "top_picks": [
    "2607.27913",
    "2607.27308",
    "2607.27268",
    "2607.24834",
    "2607.24519"
  ]
}
