{
  "featured_paper": null,
  "month": "2026-01",
  "sections": [
    {
      "paper_ids": [
        "2601.21965"
      ],
      "title": "application"
    },
    {
      "paper_ids": [
        "2601.00573",
        "2601.17883"
      ],
      "title": "benchmark"
    },
    {
      "paper_ids": [
        "2601.06134",
        "2601.07877",
        "2601.22197"
      ],
      "title": "new_model"
    }
  ],
  "stats": {
    "accepted": 6,
    "candidates": 22,
    "summarized": 6
  },
  "top_picks": [
    "2601.21965",
    "2601.17883",
    "2601.06134",
    "2601.22197",
    "2601.07877"
  ]
}
