{
  "featured_paper": "2511.13733",
  "month": "2025-11",
  "sections": [
    {
      "paper_ids": [
        "2512.08959"
      ],
      "title": "benchmark"
    },
    {
      "paper_ids": [
        "2511.13733",
        "2511.05863",
        "2511.08444",
        "2511.08861",
        "2511.11940",
        "2511.16828",
        "2511.18571"
      ],
      "title": "new_model"
    }
  ],
  "stats": {
    "accepted": 8,
    "candidates": 36,
    "summarized": 8
  },
  "top_picks": [
    "2511.08861",
    "2512.08959",
    "2511.18571",
    "2511.16828",
    "2511.13733"
  ]
}
