{
  "featured_paper": null,
  "month": "2026-02",
  "sections": [
    {
      "paper_ids": [
        "2602.11558"
      ],
      "title": "benchmark"
    },
    {
      "paper_ids": [
        "2602.17251"
      ],
      "title": "method"
    },
    {
      "paper_ids": [
        "2602.18478",
        "2602.13857",
        "2602.16951",
        "2603.16880",
        "2602.23410",
        "2603.13272",
        "2603.02268"
      ],
      "title": "new_model"
    },
    {
      "paper_ids": [
        "2602.03269"
      ],
      "title": "survey"
    }
  ],
  "stats": {
    "accepted": 10,
    "candidates": 27,
    "summarized": 10
  },
  "top_picks": [
    "2603.16880",
    "2603.13272",
    "2603.02268",
    "2602.23410",
    "2602.17251"
  ]
}
